{"WhoisRecord": {
  "domainName": "garatinterbk.online",
  "parseCode": 8,
  "audit": {
    "createdDate": "2021-08-01 19:21:38 UTC",
    "updatedDate": "2021-08-01 19:21:38 UTC"
  },
  "registrarName": "Namecheap",
  "registrarIANAID": "1068",
  "registryData": {
    "createdDate": "2021-02-13T10:53:20.0Z",
    "updatedDate": "2021-06-16T15:46:11.0Z",
    "expiresDate": "2022-02-13T23:59:59.0Z",
    "registrant": {
      "organization": "Privacy service provided by Withheld for Privacy ehf",
      "state": "Capital Region",
      "country": "ICELAND",
      "countryCode": "IS",
      "rawText": "Registrant Organization: Privacy service provided by Withheld for Privacy ehf\u000aRegistrant State/Province: Capital Region\u000aRegistrant Country: IS\u000aRegistrant Email: Please query the RDDS service of the Registrar of Record identified in this output for information on how to contact the Registrant, Admin, or Tech contact of the queried domain name."
    },
    "administrativeContact": {
      "country": "ICELAND",
      "countryCode": "IS",
      "rawText": "Admin Email: Please query the RDDS service of the Registrar of Record identified in this output for information on how to contact the Registrant, Admin, or Tech contact of the queried domain name."
    },
    "billingContact": {
      "country": "ICELAND",
      "countryCode": "IS",
      "rawText": "Billing Email: Please query the RDDS service of the Registrar of Record identified in this output for information on how to contact the Registrant, Admin, or Tech contact of the queried domain name."
    },
    "technicalContact": {
      "country": "ICELAND",
      "countryCode": "IS",
      "rawText": "Tech Email: Please query the RDDS service of the Registrar of Record identified in this output for information on how to contact the Registrant, Admin, or Tech contact of the queried domain name."
    },
    "domainName": "garatinterbk.online",
    "nameServers": {
      "rawText": "NS1.CHAKAUWKYWA.WEBSITE\u000aNS2.CHAKAUWKYWA.WEBSITE\u000a",
      "hostNames": [
        "NS1.CHAKAUWKYWA.WEBSITE",
        "NS2.CHAKAUWKYWA.WEBSITE"
      ],
      "ips": [
      ]
    },
    "status": "serverHold clientTransferProhibited",
    "rawText": "Domain Name: GARATINTERBK.ONLINE\u000aRegistry Domain ID: D221543303-CNIC\u000aRegistrar WHOIS Server: whois.namecheap.com\u000aRegistrar URL: https://namecheap.com\u000aUpdated Date: 2021-06-16T15:46:11.0Z\u000aCreation Date: 2021-02-13T10:53:20.0Z\u000aRegistry Expiry Date: 2022-02-13T23:59:59.0Z\u000aRegistrar: Namecheap\u000aRegistrar IANA ID: 1068\u000aDomain Status: serverHold https://icann.org/epp#serverHold\u000aDomain Status: clientTransferProhibited https://icann.org/epp#clientTransferProhibited\u000aRegistrant Organization: Privacy service provided by Withheld for Privacy ehf\u000aRegistrant State/Province: Capital Region\u000aRegistrant Country: IS\u000aRegistrant Email: Please query the RDDS service of the Registrar of Record identified in this output for information on how to contact the Registrant, Admin, or Tech contact of the queried domain name.\u000aAdmin Email: Please query the RDDS service of the Registrar of Record identified in this output for information on how to contact the Registrant, Admin, or Tech contact of the queried domain name.\u000aTech Email: Please query the RDDS service of the Registrar of Record identified in this output for information on how to contact the Registrant, Admin, or Tech contact of the queried domain name.\u000aName Server: NS1.CHAKAUWKYWA.WEBSITE\u000aName Server: NS2.CHAKAUWKYWA.WEBSITE\u000aDNSSEC: unsigned\u000aBilling Email: Please query the RDDS service of the Registrar of Record identified in this output for information on how to contact the Registrant, Admin, or Tech contact of the queried domain name.\u000aRegistrar Abuse Contact Email: abuse@namecheap.com\u000aRegistrar Abuse Contact Phone: +1.6613102107\u000aURL of the ICANN Whois Inaccuracy Complaint Form: https://www.icann.org/wicf/\u000a>>> Last update of WHOIS database: 2021-08-01T19:21:37.0Z <<<\u000a\u000aFor more information on Whois status codes, please visit https://icann.org/epp\u000a\u000a>>> IMPORTANT INFORMATION ABOUT THE DEPLOYMENT OF RDAP: please visit\u000ahttps://www.centralnic.com/support/rdap <<<\u000a\u000aThe Whois and RDAP services are provided by CentralNic, and contain\u000ainformation pertaining to Internet domain names registered by our\u000aour customers. By using this service you are agreeing (1) not to use any\u000ainformation presented here for any purpose other than determining\u000aownership of domain names, (2) not to store or reproduce this data in\u000aany way, (3) not to use any high-volume, automated, electronic processes\u000ato obtain data from this service. Abuse of this service is monitored and\u000aactions in contravention of these terms will result in being permanently\u000ablacklisted. All data is (c) CentralNic Ltd (https://www.centralnic.com)\u000a\u000aAccess to the Whois and RDAP services is rate limited. For more\u000ainformation, visit https://registrar-console.centralnic.com/pub/whois_guidance.",
    "parseCode": 4091,
    "header": "",
    "strippedText": "Domain Name: GARATINTERBK.ONLINE\u000aRegistrar WHOIS Server: whois.namecheap.com\u000aRegistrar URL: https://namecheap.com\u000aUpdated Date: 2021-06-16T15:46:11.0Z\u000aCreation Date: 2021-02-13T10:53:20.0Z\u000aRegistry Expiry Date: 2022-02-13T23:59:59.0Z\u000aRegistrar: Namecheap\u000aRegistrar IANA ID: 1068\u000aDomain Status: serverHold https://icann.org/epp#serverHold\u000aDomain Status: clientTransferProhibited https://icann.org/epp#clientTransferProhibited\u000aRegistrant Organization: Privacy service provided by Withheld for Privacy ehf\u000aRegistrant State/Province: Capital Region\u000aRegistrant Country: IS\u000aRegistrant Email: Please query the RDDS service of the Registrar of Record identified in this output for information on how to contact the Registrant, Admin, or Tech contact of the queried domain name.\u000aAdmin Email: Please query the RDDS service of the Registrar of Record identified in this output for information on how to contact the Registrant, Admin, or Tech contact of the queried domain name.\u000aTech Email: Please query the RDDS service of the Registrar of Record identified in this output for information on how to contact the Registrant, Admin, or Tech contact of the queried domain name.\u000aName Server: NS1.CHAKAUWKYWA.WEBSITE\u000aName Server: NS2.CHAKAUWKYWA.WEBSITE\u000aBilling Email: Please query the RDDS service of the Registrar of Record identified in this output for information on how to contact the Registrant, Admin, or Tech contact of the queried domain name.\u000aRegistrar Abuse Contact Email: abuse@namecheap.com\u000aRegistrar Abuse Contact Phone: +1.6613102107\u000a",
    "footer": "\u000a",
    "audit": {
      "createdDate": "2021-08-01 19:21:38 UTC",
      "updatedDate": "2021-08-01 19:21:38 UTC"
    },
    "customField1Name": "RegistrarContactEmail",
    "customField1Value": "abuse@namecheap.com",
    "registrarName": "Namecheap",
    "registrarIANAID": "1068",
    "createdDateNormalized": "2021-02-13 10:53:20 UTC",
    "updatedDateNormalized": "2021-06-16 15:46:11 UTC",
    "expiresDateNormalized": "2022-02-13 23:59:59 UTC",
    "customField2Name": "RegistrarContactPhone",
    "customField3Name": "RegistrarURL",
    "customField2Value": "+1.6613102107",
    "customField3Value": "https://namecheap.com",
    "whoisServer": "whois.namecheap.com"
  },
  "contactEmail": "abuse@namecheap.com",
  "domainNameExt": ".online",
  "estimatedDomainAge": 170
}}